{
  "id": "belote",
  "specVersion": 1,
  "rulesVersion": 1,

  "name": { "fr": "Belote", "en": "Belote", "es": "Belote", "de": "Belote", "it": "Belote" },
  "shortDescription": {
    "fr": "Par équipes de deux. 162 points par donne ; la première équipe à 1000 gagne.",
    "en": "Two teams of two. 162 points per hand; first team to 1000 wins.", "es": "Dos equipos de dos. 162 puntos por mano; el primer equipo en llegar a 1000 gana.", "de": "Zwei Teams zu zweit. 162 Punkte pro Hand; das erste Team bei 1000 gewinnt.", "it": "Due squadre da due. 162 punti a mano; la prima squadra a 1000 vince."
  },

  "symbol": "suit.club.fill",
  "paletteID": "violet",

  "players": {
    "min": 4,
    "max": 4,
    "recommended": [4],
    "teams": { "size": 2, "fixed": true }
  },

  "scoring": {
    "direction": "highestWins",
    "aggregation": "cumulative",
    "roundLabel": { "fr": "Donne", "en": "Hand", "es": "Mano", "de": "Hand", "it": "Mano" },
    "entry": {
      "kind": "structured",
      "min": 0,
      "max": 250
    },
    "modifiers": [
      {
        "id": "isTaker",
        "label": { "fr": "Équipe preneuse", "en": "Taking team", "es": "Equipo atacante", "de": "Angreifendes Team", "it": "Squadra attaccante" },
        "kind": "exclusiveFlag",
        "required": true
      },
      {
        "id": "capot",
        "label": { "fr": "Capot", "en": "Capot", "es": "Capot", "de": "Capot", "it": "Capot" },
        "kind": "flag"
      },
      {
        "id": "beloteRebelote",
        "label": { "fr": "Belote-rebelote", "en": "Belote-rebelote", "es": "Belote-rebelote", "de": "Belote-rebelote", "it": "Belote-rebelote" },
        "kind": "flag"
      }
    ]
  },

  "engine": "belote.v1",

  "end": {
    "conditions": [
      {
        "type": "scoreThreshold",
        "value": 1000,
        "variantKey": "threshold",
        "comparison": ">=",
        "scope": "anyPlayer",
        "completeRound": true
      }
    ]
  },

  "tieBreak": ["shared"],

  "variants": [
    {
      "id": "threshold",
      "label": { "fr": "Fin de partie à", "en": "Game ends at", "es": "Fin de partida a", "de": "Spielende bei", "it": "Fine partita a" },
      "kind": "integerChoice",
      "values": [501, 1000, 2000],
      "default": 1000
    }
  ],

  "statsProfiles": ["standard"]
}
