{
  "id": "jeu-libre",
  "specVersion": 1,
  "rulesVersion": 1,

  "name": { "fr": "Jeu libre", "en": "Free scoring", "es": "Puntuación libre", "de": "Freie Zählung", "it": "Punteggio libero" },
  "shortDescription": {
    "fr": "Un tableau de scores pour n'importe quel jeu. Le score le plus haut gagne ; c'est toi qui décides quand la partie se termine.",
    "en": "A scoreboard for any game. Highest score wins; you decide when the game ends.", "es": "Un marcador para cualquier juego. Gana la puntuación más alta; tú decides cuándo termina la partida.", "de": "Eine Punktetafel für jedes Spiel. Die höchste Punktzahl gewinnt; du entscheidest, wann das Spiel endet.", "it": "Un tabellone punti per qualsiasi gioco. Vince il punteggio più alto; decidi tu quando finisce la partita."
  },

  "symbol": "square.and.pencil",
  "paletteID": "ardoise",

  "players": { "min": 1, "max": 12, "recommended": [2, 3, 4] },

  "scoring": {
    "direction": "highestWins",
    "aggregation": "cumulative",
    "roundLabel": { "fr": "Manche", "en": "Round", "es": "Manga", "de": "Runde", "it": "Manche" },
    "entry": {
      "kind": "integer",
      "allowsNegative": true
    },
    "modifiers": []
  },

  "engine": "generic.sum.v1",

  "end": {
    "conditions": [
      {
        "type": "manualStop",
        "scope": "anyPlayer"
      }
    ]
  },

  "tieBreak": ["shared"],

  "statsProfiles": ["standard"]
}
